{
  "$schema": "https://json-schema.org/draft/2020-12/schema",
  "$id": "https://linhongcun.github.io/aoe2-analyzer/schema/content-game-guide.json",
  "title": "Curated game-guide content",
  "type": "object",
  "properties": {
    "schemaVersion": {
      "const": 1
    },
    "checkedAt": {
      "type": "string",
      "pattern": "^[0-9]{4}-(0[1-9]|1[0-2])-(0[1-9]|[12][0-9]|3[01])$"
    },
    "dataVersion": {
      "type": "string",
      "pattern": "^DE[0-9]+$"
    },
    "scope": {
      "$ref": "common.defs.json#/$defs/sourceText"
    },
    "sources": {
      "type": "object",
      "additionalProperties": {
        "$ref": "#/$defs/source"
      },
      "properties": {
        "pinned-techs": {
          "$ref": "#/$defs/pinnedTechProvenance"
        }
      }
    },
    "cards": {
      "type": "array",
      "items": {
        "$ref": "#/$defs/card"
      },
      "minItems": 1
    }
  },
  "required": ["schemaVersion", "checkedAt", "dataVersion", "scope", "sources", "cards"],
  "additionalProperties": false,
  "$defs": {
    "source": {
      "type": "object",
      "properties": {
        "title": {
          "allOf": [
            {
              "$ref": "common.defs.json#/$defs/sourceText"
            },
            {
              "type": "string",
              "minLength": 1
            }
          ]
        },
        "url": {
          "$ref": "common.defs.json#/$defs/publicUrl"
        },
        "kind": {
          "allOf": [
            {
              "$ref": "common.defs.json#/$defs/sourceText"
            },
            {
              "type": "string",
              "minLength": 1
            }
          ]
        },
        "checkedAt": {
          "type": "string",
          "pattern": "^[0-9]{4}-(0[1-9]|1[0-2])-(0[1-9]|[12][0-9]|3[01])$"
        },
        "publishedAt": {
          "anyOf": [
            {
              "type": "string",
              "pattern": "^[0-9]{4}-(0[1-9]|1[0-2])-(0[1-9]|[12][0-9]|3[01])$"
            },
            {
              "type": "null"
            }
          ]
        },
        "version": {
          "$ref": "common.defs.json#/$defs/sourceText"
        },
        "locator": {
          "$ref": "common.defs.json#/$defs/sourceText"
        },
        "note": {
          "$ref": "common.defs.json#/$defs/sourceText"
        }
      },
      "required": ["title", "url", "kind", "checkedAt", "publishedAt", "version", "locator", "note"],
      "additionalProperties": false
    },
    "card": {
      "type": "object",
      "properties": {
        "id": {
          "type": "string",
          "enum": ["goal", "roles", "resources", "ages", "counters", "watching"]
        },
        "title": {
          "allOf": [
            {
              "$ref": "common.defs.json#/$defs/sourceText"
            },
            {
              "type": "string",
              "minLength": 1
            }
          ]
        },
        "shortTitle": {
          "allOf": [
            {
              "$ref": "common.defs.json#/$defs/sourceText"
            },
            {
              "type": "string",
              "minLength": 1
            }
          ]
        },
        "summary": {
          "$ref": "common.defs.json#/$defs/sourceText"
        },
        "paragraphs": {
          "type": "array",
          "items": {
            "$ref": "common.defs.json#/$defs/sourceText"
          }
        },
        "example": {
          "$ref": "common.defs.json#/$defs/sourceText"
        },
        "question": {
          "$ref": "common.defs.json#/$defs/sourceText"
        },
        "answer": {
          "$ref": "common.defs.json#/$defs/sourceText"
        },
        "boundary": {
          "$ref": "common.defs.json#/$defs/sourceText"
        },
        "sourceIds": {
          "type": "array",
          "items": {
            "$ref": "common.defs.json#/$defs/nonEmptyString"
          },
          "minItems": 1,
          "uniqueItems": true
        },
        "links": {
          "type": "array",
          "items": {
            "type": "object",
            "properties": {
              "label": {
                "allOf": [
                  {
                    "$ref": "common.defs.json#/$defs/sourceText"
                  },
                  {
                    "type": "string",
                    "minLength": 1
                  }
                ]
              },
              "to": {
                "type": "string",
                "pattern": "^/(?!/)[^\\s]*$"
              }
            },
            "required": ["label", "to"],
            "additionalProperties": false
          }
        }
      },
      "required": ["id", "title", "shortTitle", "summary", "paragraphs", "example", "question", "answer", "boundary", "sourceIds", "links"],
      "additionalProperties": false
    },
    "pinnedTechProvenance": {
      "type": "object",
      "properties": {
        "title": {
          "allOf": [
            {
              "$ref": "common.defs.json#/$defs/sourceText"
            },
            {
              "type": "string",
              "minLength": 1
            }
          ]
        },
        "url": {
          "$ref": "common.defs.json#/$defs/publicUrl"
        },
        "kind": {
          "allOf": [
            {
              "$ref": "common.defs.json#/$defs/sourceText"
            },
            {
              "type": "string",
              "minLength": 1
            }
          ]
        },
        "checkedAt": {
          "type": "string",
          "pattern": "^[0-9]{4}-(0[1-9]|1[0-2])-(0[1-9]|[12][0-9]|3[01])$"
        },
        "publishedAt": {
          "anyOf": [
            {
              "type": "string",
              "pattern": "^[0-9]{4}-(0[1-9]|1[0-2])-(0[1-9]|[12][0-9]|3[01])$"
            },
            {
              "type": "null"
            }
          ]
        },
        "version": {
          "anyOf": [
            {
              "$ref": "common.defs.json#/$defs/sourceText"
            },
            {
              "type": "string",
              "pattern": "^main [0-9a-f]{7,40} / DE[0-9]+$"
            }
          ]
        },
        "locator": {
          "$ref": "common.defs.json#/$defs/sourceText"
        },
        "note": {
          "$ref": "common.defs.json#/$defs/sourceText"
        }
      },
      "required": ["title", "url", "kind", "checkedAt", "publishedAt", "version", "locator", "note"],
      "additionalProperties": false,
      "allOf": [
        {
          "if": {
            "properties": {
              "version": {
                "type": "string",
                "pattern": "^main [0-9a-f]{7,40} / DE[0-9]+$"
              }
            },
            "required": ["version"]
          },
          "then": {
            "properties": {
              "url": {
                "type": "string",
                "pattern": "^https://github\\.com/linhongcun/aoe2-analyzer/blob/[0-9a-f]{40}/src/data/techs\\.json$"
              }
            }
          }
        }
      ]
    }
  }
}
