{
  "schemaVersion": 1,
  "checkedAt": "2026-10-20",
  "dataVersion": "DE185872",
  "scope": "常规 AoE2 DE 随机地图；通用黑暗时代开局示例；征服胜利设置",
  "sources": {
    "official-start": {
      "title": "官方：Getting Started（PC）",
      "url": "https://www.ageofempires.com/learn-to-play/getting-started-aoe2/",
      "kind": "官方教学",
      "checkedAt": "2026-10-20",
      "publishedAt": null,
      "version": "现行官方教学；非逐项 DE185872 客户端实测",
      "locator": "Lessons 1–3：一局目标、村民/建筑、科技与时代",
      "note": "只采用通用角色与经济关系；没有照搬文明起始配置、费用或建议时点。"
    },
    "official-expansion": {
      "title": "官方：Expanding Your Empire（PC）",
      "url": "https://www.ageofempires.com/learn-to-play/expanding-your-empire-aoe2/",
      "kind": "官方教学",
      "checkedAt": "2026-10-20",
      "publishedAt": null,
      "version": "现行官方教学；常规随机地图示例",
      "locator": "Lessons 1–3：地图视野、开局分工、经济服务于计划",
      "note": "原文提示文明开局可能不同。本页不采用起始人数、资源数量或固定经济配比。"
    },
    "official-defense": {
      "title": "官方：Building & Defending Your Empire（PC）",
      "url": "https://www.ageofempires.com/learn-to-play/defending-your-empires-aoe2/",
      "kind": "官方教学",
      "checkedAt": "2026-10-20",
      "publishedAt": null,
      "version": "现行官方教学；只用一般信息与角色说明",
      "locator": "Lessons 1、3、6：地图信息、对手位置、城镇中心角色",
      "note": "没有采用地图资源数量或将经济线索唯一对应敌方策略的表述。"
    },
    "official-military": {
      "title": "官方：Military & Economy（Xbox）",
      "url": "https://www.ageofempires.com/learn-to-play/military-economy-xbox/",
      "kind": "官方教学（跨平台通用规则）",
      "checkedAt": "2026-10-20",
      "publishedAt": null,
      "version": "只引用一般玩法；不采用手柄操作与自动村民机制",
      "locator": "Lessons 1、3、5、7：征服、单位用途与经济取舍",
      "note": "单位针对关系为入门线索，不采用绝对输赢、固定研究顺序或操作平台专有功能。"
    },
    "official-185872": {
      "title": "官方：Update 185872",
      "url": "https://www.ageofempires.com/news/age-of-empires-ii-definitive-edition-update-185872/",
      "kind": "官方补丁",
      "checkedAt": "2026-10-20",
      "publishedAt": "2026-09-22",
      "version": "DE185872",
      "locator": "Huns / Atheism：提及 Wonder 与 Relic victory timer",
      "note": "仅证明该固定版本仍存在相关可选胜利机制；本页不解释倒计时、配置规则或宣称天梯默认启用。"
    },
    "pinned-techs": {
      "title": "本站固定科技数据",
      "url": "https://github.com/linhongcun/aoe2-analyzer/blob/8d669acf8cae1a939169da91396de535f1ddf758/src/data/techs.json",
      "kind": "固定数据快照",
      "checkedAt": "2026-10-20",
      "publishedAt": null,
      "version": "main 8d669ac / DE185872",
      "locator": "科技 101 / 102 / 103 的时代名称与说明",
      "note": "只核对封建、城堡、帝王时代标签与解锁的一般含义；没有复制费用、耗时或文明研究资格。"
    }
  },
  "cards": [
    {
      "id": "goal",
      "title": "这一局怎样才算结束？",
      "shortTitle": "本局目标",
      "summary": "先看胜利设置，再看双方如何让自己的计划持续下去。",
      "paragraphs": [
        "本页示例采用征服设置：通过军事与战略击败所有敌方，或让对方投降结束比赛。分数领先只是当前局势的一个提示，不是已经获胜。",
        "经济、科技和军队互相支撑。征服不等于只盯着单位击杀；能否继续获得资源、补充部队和守住关键位置，也值得观察。"
      ],
      "example": "一方赢下交战，但对方仍有经济和生产能力。这场交战可以形成优势，比赛却未必已经结束。",
      "question": "看到分数领先，就可以宣布这一方获胜吗？",
      "answer": "不能。先确认本局胜利设置，再看是否已达成结束条件或出现投降；本页不提供自动胜负判断。",
      "boundary": "其他胜利设置可能涉及奇观、圣物或特殊目标；本页没有展开这些规则，也不把它们当所有天梯的默认条件。",
      "sourceIds": ["official-start", "official-military", "official-185872"],
      "links": [
        {
          "label": "选择入门战役",
          "to": "/campaigns"
        },
        {
          "label": "了解圣物资源收入",
          "to": "/relic-income"
        }
      ]
    },
    {
      "id": "roles",
      "title": "TC、村民和侦察兵各忙什么？",
      "shortTitle": "开局角色",
      "summary": "同一时间，生产、采集和获取信息都在进行。",
      "paragraphs": [
        "TC 是 Town Center，即城镇中心。它能训练村民、研究相关科技并进行时代升级；村民负责采集资源和建造、修理建筑。",
        "侦察单位帮助寻找资源、理解道路与发现对手。已探索区域不等于一直有视野；离开视线后的敌方变化仍可能未知。"
      ],
      "example": "画面切到侦察单位时，家里的村民仍在工作。观赛可以交替关注信息从哪里来，以及经济是否支持接下来的行动。",
      "question": "地图已经探开，是否代表知道敌人此刻正在做什么？",
      "answer": "不代表。要区分曾经探索的地形和当前视野，回看资料时也别把全图信息当玩家当时已经知道。",
      "boundary": "这里只解释通用角色，不规定起始村民或侦察单位的数量、种类；不同文明和特殊开局需另查。",
      "sourceIds": ["official-start", "official-expansion", "official-defense"],
      "links": [
        {
          "label": "查操作含义与个人按键",
          "to": "/hotkeys"
        },
        {
          "label": "查中英术语",
          "to": "/glossary"
        }
      ]
    },
    {
      "id": "resources",
      "title": "资源怎样变成可以执行的计划？",
      "shortTitle": "经济转化",
      "summary": "采得多之外，还要看资源是否能用到当前计划上。",
      "paragraphs": [
        "食物、木材、黄金和石头用于不同的单位、建筑或科技。选择想做的事，再查看它需要的资源与前置，会比单看库存数字更容易理解经济。",
        "建筑提供训练、研究或防御等用途，生产和研究还需要时间。资源在仓库里，与已经投入的建筑、科技和军队是不同的状态。"
      ],
      "example": "两位玩家库存都不少，但一方准备升级，另一方缺生产建筑。相同的库存画面，可能有不同的计划和问题，不能仅据此判定谁更会发展。",
      "question": "库存很高，是否就说明经济一定更好？",
      "answer": "不能只看库存。还需知道正在为哪个目标准备、资源能否及时投入，以及是否缺少必要建筑或前置。",
      "boundary": "例子是观察提示，不给所有文明统一的库存阈值、采集人数或经济合格线。",
      "sourceIds": ["official-start", "official-expansion", "official-military"],
      "links": [
        {
          "label": "估算持续生产需求",
          "to": "/production"
        },
        {
          "label": "对照经济科技投入",
          "to": "/eco-payoff"
        }
      ]
    },
    {
      "id": "ages",
      "title": "时代升级和当前压力怎样取舍？",
      "shortTitle": "时代与局势",
      "summary": "时代提供新选择，投资却需要放进当下局势里理解。",
      "paragraphs": [
        "常规黑暗时代之后可继续进入封建、城堡和帝王时代。升级能带来新的单位、科技和建筑选择，但具体资格与研究前置还取决于文明与配置。",
        "同一批资源可以用于眼前生产、防御或更长远的升级。观赛时可以问：这次投入准备解决什么问题，期间是否有能力处理对方的压力？"
      ],
      "example": "一方先升级，另一方暂时补充部队。仅凭谁先到下个时代，不能断言谁一定有利；还要看双方正在做的事与军队位置。",
      "question": "时代更高的一方，是否必然赢下当前交战？",
      "answer": "不是。时代本身不证明需要的研究已经完成、军队已到位或资源足够；应继续核对实际单位、升级和场面。",
      "boundary": "不提供固定升级时点、速城配方或按时代直接宣布胜负；战役和特殊开局可能另有规则。",
      "sourceIds": ["official-start", "pinned-techs", "official-military"],
      "links": [
        {
          "label": "查看文明科技树",
          "to": "/tree"
        },
        {
          "label": "进入开局流程",
          "to": "/builds"
        },
        {
          "label": "区分攻略的时间口径",
          "to": "/game-clock"
        }
      ]
    },
    {
      "id": "counters",
      "title": "克制关系为什么不是必胜三角？",
      "shortTitle": "有条件的克制",
      "summary": "兵种用途是起点，还要核对数量、升级和能否有效交战。",
      "paragraphs": [
        "例如长枪系通常用于针对骑兵，但“有针对用途”不等于随便带多少都能打赢。实际形态、升级、数量、保护与接战条件都要继续看。",
        "地形、操作与组合部队会改变交战方式。本站 PK 可帮助理解其明确建模的局部条件，不能把模型结果当作整局或所有微操下的保证。"
      ],
      "example": "少量反制单位尚未集结，却被完整军队逐个接近。兵种标签仍有意义，但不足以单独解释这次交战的结果。",
      "question": "看到兵种互相克制，下一步还应查什么？",
      "answer": "查实际数量与形态、已完成升级、保护与交战位置，并区分已知事实和没看到的信息；资料不完整时保留判断。",
      "boundary": "不提供固定最优配比、微操胜率或保证取胜；也不把地形与走位当本站 PK 已验证的机制。",
      "sourceIds": ["official-military", "official-start"],
      "links": [
        {
          "label": "查看单位 PK 的适用条件",
          "to": "/duel"
        },
        {
          "label": "查看有限混兵情境",
          "to": "/mixed-army"
        },
        {
          "label": "查看已辨认快攻的应对",
          "to": "/matchup"
        }
      ]
    },
    {
      "id": "watching",
      "title": "观赛时可以先盯住哪些问题？",
      "shortTitle": "观赛关注点",
      "summary": "沿着经济、军队和信息看一段变化，不必一次记住所有细节。",
      "paragraphs": [
        "看经济：资源和生产在为哪个计划服务？看军队：部队在哪里，正在争夺或保护什么？看信息：玩家当时看到了什么，还缺什么？",
        "把镜头里的现象与自己的解释分开。解说或回放可能展示双方全图，玩家实际视野却有限；看到优势线索后仍要留意后续变化。"
      ],
      "example": "一支军队出现在边路，可以先记录它的位置，再观察守方是否有视野与回应。不要用回放里能看到的全图，直接断言守方早该知道。",
      "question": "刚开始看比赛，是否必须同时跟上每一次操作？",
      "answer": "不必。可以先选择经济、军队或信息中的一个问题，追踪一段变化，再补看其他视角；这是阅读方法，不是自动分析结论。",
      "boundary": "观赛提示由本站整理，不评估观众理解程度，也不根据比分或解说用语自动裁定局势。",
      "sourceIds": ["official-start", "official-defense", "official-military"],
      "links": [
        {
          "label": "查社区术语",
          "to": "/glossary"
        },
        {
          "label": "了解不同内容与模式",
          "to": "/content-guide"
        },
        {
          "label": "找适合的入门战役",
          "to": "/campaigns"
        }
      ]
    }
  ]
}
